<ruleset xmlns="http://codenarc.org/ruleset/1.0"
        xmlns:xsi="http://www.w3.org/2001/XMLSchema-instance"
        xsi:schemaLocation="http://codenarc.org/ruleset/1.0 http://codenarc.org/ruleset-schema.xsd"
        xsi:noNamespaceSchemaLocation="http://codenarc.org/ruleset-schema.xsd">

    <description>Sample rule set #2</description>

    <ruleset-ref path='rulesets/imports.xml'/>

    <ruleset-ref path='rulesets/basic.xml'>
        <exclude name='StringInstantiation'/>
    </ruleset-ref>

    <ruleset-ref path='rulesets/size.xml'>
        <rule-config name='ClassSize'>
            <property name='maxLines' value='500'/>
        </rule-config>
    </ruleset-ref>

    <rule class='org.codenarc.rule.generic.IllegalRegexRule'>
        <property name="name" value="AuthorTagNotAllowed"/>
        <property name='regex' value='\@author'/>
    </rule>

    <rule class='org.codenarc.rule.naming.VariableNameRule'>
        <property name="finalRegex" value="F_[A-Z0-9]*"/>
        <property name='priority' value='1'/>
    </rule>

</ruleset>