<ruleset xmlns="http://codenarc.org/ruleset/1.0"
        xmlns:xsi="http://www.w3.org/2001/XMLSchema-instance"
        xsi:schemaLocation="http://codenarc.org/ruleset/1.0 http://codenarc.org/ruleset-schema.xsd"
        xsi:noNamespaceSchemaLocation="http://codenarc.org/ruleset-schema.xsd">

    <description>Sample rule set</description>

    <ruleset-ref path='rulesets/imports.xml'>
        <rule-config name='DuplicateImport'>
            <property name='priority' value='1'/>
        </rule-config>
    </ruleset-ref>

    <ruleset-ref path='rulesets/basic.xml'>
        <exclude name='StringInstantiation'/>
    </ruleset-ref>

    <rule class='org.codenarc.rule.exceptions.CatchThrowableRule'>
        <property name='priority' value='1'/>
    </rule>

</ruleset>