<ruleset xmlns="http://codenarc.org/ruleset/1.0"
        xmlns:xsi="http://www.w3.org/2001/XMLSchema-instance"
        xsi:schemaLocation="http://codenarc.org/ruleset/1.0 http://codenarc.org/ruleset-schema.xsd"
        xsi:noNamespaceSchemaLocation="http://codenarc.org/ruleset-schema.xsd">

    <description>
        Imports rule set.
        These rules implement standards and best practices related to import statements.
    </description>

    <rule class='org.codenarc.rule.imports.DuplicateImportRule'/>
    <rule class='org.codenarc.rule.imports.ImportFromSamePackageRule'/>
    <rule class='org.codenarc.rule.imports.UnnecessaryGroovyImportRule'/>
    <rule class='org.codenarc.rule.imports.UnusedImportRule'/>

    <rule class='org.codenarc.rule.imports.ImportFromSunPackagesRule'/>
    <rule class='org.codenarc.rule.imports.MisorderedStaticImportsRule'/>
    <rule class='org.codenarc.rule.imports.NoWildcardImportsRule'/>
</ruleset>