<ruleset xmlns="http://codenarc.org/ruleset/1.0"
        xmlns:xsi="http://www.w3.org/2001/XMLSchema-instance"
        xsi:schemaLocation="http://codenarc.org/ruleset/1.0 http://codenarc.org/ruleset-schema.xsd"
        xsi:noNamespaceSchemaLocation="http://codenarc.org/ruleset-schema.xsd">

    <description>
        Naming rule set.
        These rules validate names within the source code.
    </description>

    <rule class='org.codenarc.rule.naming.AbstractClassNameRule'/>
    <rule class='org.codenarc.rule.naming.ClassNameRule'/>
    <rule class='org.codenarc.rule.naming.ClassNameSameAsFilenameRule'/>
    <rule class='org.codenarc.rule.naming.ConfusingMethodNameRule'/>
    <rule class='org.codenarc.rule.naming.FieldNameRule'/>
    <rule class='org.codenarc.rule.naming.InterfaceNameRule'/>
    <rule class='org.codenarc.rule.naming.MethodNameRule'/>
    <rule class='org.codenarc.rule.naming.ObjectOverrideMisspelledMethodNameRule'/>
    <rule class='org.codenarc.rule.naming.PackageNameRule'/>
    <rule class='org.codenarc.rule.naming.PackageNameMatchesFilePathRule'/>
    <rule class='org.codenarc.rule.naming.ParameterNameRule'/>
    <rule class='org.codenarc.rule.naming.PropertyNameRule'/>
    <rule class='org.codenarc.rule.naming.VariableNameRule'/>
    <rule class='org.codenarc.rule.naming.FactoryMethodNameRule'/>
</ruleset>
