<ruleset xmlns="http://codenarc.org/ruleset/1.0"
        xmlns:xsi="http://www.w3.org/2001/XMLSchema-instance"
        xsi:schemaLocation="http://codenarc.org/ruleset/1.0 http://codenarc.org/ruleset-schema.xsd"
        xsi:noNamespaceSchemaLocation="http://codenarc.org/ruleset-schema.xsd">

    <description>
        Generic rule set.
        These rules are generic, and are intended to be customized.
    </description>

    <rule class='org.codenarc.rule.generic.IllegalClassMemberRule'/>
    <rule class='org.codenarc.rule.generic.IllegalClassReferenceRule'/>
    <rule class='org.codenarc.rule.generic.IllegalPackageReferenceRule'/>
    <rule class='org.codenarc.rule.generic.IllegalRegexRule'/>
    <rule class='org.codenarc.rule.generic.IllegalStringRule'/>
    <rule class='org.codenarc.rule.generic.IllegalSubclassRule'/>
    <rule class='org.codenarc.rule.generic.RequiredRegexRule'/>
    <rule class='org.codenarc.rule.generic.RequiredStringRule'/>
    <rule class='org.codenarc.rule.generic.StatelessClassRule'/>
</ruleset>